{
  "characters": [
    {
      "aliases": [
        "Jake",
        "Lord Thane"
      ],
      "description": "Haven’s owner, a D-grade hunter and accomplished alchemist preparing for the Treasure Hunt. At Miranda’s request, he makes his strength unmistakable to the independent fighters gathered in his city.",
      "id": "jake-thayne",
      "name": "Jake Thayne",
      "reveal": {
        "chapter": 1
      },
      "role": "protagonist"
    },
    {
      "description": "Jake's powerful hawk companion, treated as family and already capable of operating on her own. She accompanies him before the Treasure Hunt and helps establish that Haven is far better defended than its visitors first assume.",
      "id": "sylphie",
      "name": "Sylphie",
      "reveal": {
        "chapter": 1
      },
      "role": "supporting"
    },
    {
      "description": "Haven's organizer and a user of green magic. She assembles the city's prospective Treasure Hunt entrants, manages their preparations, and asks Jake to demonstrate the power protecting Haven before visitors mistake restraint for weakness.",
      "id": "miranda",
      "name": "Miranda",
      "reveal": {
        "chapter": 1
      },
      "role": "supporting"
    },
    {
      "description": "A secluded Haven craftsman who is initially the highest-level person visible among the city's assembled entrants. His reputation rests more on making things than on public displays of combat power, leaving many visitors unsure what he can do.",
      "id": "arnold",
      "name": "Arnold",
      "reveal": {
        "chapter": 1
      },
      "role": "supporting"
    },
    {
      "aliases": [
        "Malefic Viper"
      ],
      "description": "Jake’s primordial patron, also known as the Malefic Viper. Their divine connection is an established part of Jake’s path before the Treasure Hunt.",
      "id": "villy",
      "name": "Villy",
      "reveal": {
        "chapter": 0
      },
      "role": "supporting"
    },
    {
      "description": "A Haven space mage and teleportation researcher known before the Treasure Hunt begins. His work gives the city expertise in spatial travel and magical transport, making him an important part of its developing infrastructure.",
      "id": "neil",
      "name": "Neil",
      "reveal": {
        "chapter": 0
      },
      "role": "supporting"
    },
    {
      "aliases": [
        "Caleb Thayne"
      ],
      "description": "Jake's brother and a leader of the Court of Shadows. While his organization prepares its Treasure Hunt force, Caleb trains alone in a chamber designed to impose extreme pressure, leaving the immediate entry arrangements to others.",
      "id": "caleb",
      "name": "Caleb",
      "reveal": {
        "chapter": 2
      },
      "role": "supporting"
    },
    {
      "description": "The Holy Church's Augur, responsible for organizing its Treasure Hunt groups and guiding their search. He assigns himself to a treasure-seeking party with Bertram while directing the wider Church effort.",
      "id": "jacob",
      "name": "Jacob",
      "reveal": {
        "chapter": 2
      },
      "role": "supporting"
    },
    {
      "description": "Jacob's guardian and a Holy Church fighter. He joins the Augur's treasure-seeking group as the Church divides its entrants into smaller teams, providing direct combat support while Jacob guides the wider search.",
      "id": "bertram",
      "name": "Bertram",
      "reveal": {
        "chapter": 2
      },
      "role": "supporting"
    },
    {
      "description": "A curse-focused Risen combatant who plans to enter the Treasure Hunt with Lyra. He belongs to the large Risen force under Priscilla’s political leadership.",
      "id": "casper",
      "name": "Casper",
      "reveal": {
        "chapter": 2
      },
      "role": "supporting"
    },
    {
      "description": "Casper's Risen co-operator and intended Treasure Hunt partner. She enters with him as part of the organized force led by Priscilla, giving Casper a trusted partner within the faction's much larger expedition.",
      "id": "lyra",
      "name": "Lyra",
      "reveal": {
        "chapter": 2
      },
      "role": "supporting"
    },
    {
      "description": "The political leader of the large Risen contingent entering the Treasure Hunt. Casper and Lyra are among the roughly one thousand entrants assembled under her direction, making the Risen one of the event's largest organized forces.",
      "id": "priscilla",
      "name": "Priscilla",
      "reveal": {
        "chapter": 2
      },
      "role": "supporting"
    },
    {
      "description": "The Noboru Clan patriarch and an elite swordsman who expects to confront Jake during the Treasure Hunt. His personal strength makes him one of the event's most dangerous known entrants.",
      "id": "sword-saint",
      "name": "Sword Saint",
      "reveal": {
        "chapter": 2
      },
      "role": "supporting"
    },
    {
      "description": "An independent merchant who offers to travel with Miranda after entering the mist-covered realm. When she declines, he proceeds with his remaining follower.",
      "id": "sultan",
      "name": "Sultan",
      "reveal": {
        "chapter": 3
      },
      "role": "supporting"
    },
    {
      "description": "A formidable Valhal fighter who encounters Sylphie while hunting vampiric creatures in a bunker. Despite an awkward first approach and no shared language, she chooses to cooperate with the hawk against the surrounding enemies.",
      "id": "carmen",
      "name": "Carmen",
      "reveal": {
        "chapter": 8
      },
      "role": "supporting"
    },
    {
      "description": "The Noboru Clan patriarch's great-granddaughter, combining sword training with alchemy and advanced magical theory. After hearing that Jake killed a Count of Blood, she joins him at a cursed puzzle and identifies a flaw in his model.",
      "id": "reika",
      "name": "Reika",
      "reveal": {
        "chapter": 14
      },
      "role": "supporting"
    },
    {
      "description": "An unidentified fighter able to heal so rapidly that he outlasts a Viscount. Feeding on him poisons the vampire, and after winning he searches for a more dangerous foe.",
      "id": "regenerating-fighter",
      "name": "Regenerating Fighter",
      "reveal": {
        "chapter": 17
      },
      "role": "supporting"
    },
    {
      "description": "Caleb identifies Aaron as a dangerous opponent after hearing that he lived through a clash with an uncontrolled Count.",
      "id": "aaron",
      "name": "Aaron",
      "reveal": {
        "chapter": 22
      },
      "role": "supporting"
    },
    {
      "description": "An archer serving in Bertram's coordinated Holy Church party. She supports the group's Count hunt alongside its healer, light mage, and swordsman, contributing ranged attacks to a tightly organized team.",
      "id": "maria",
      "name": "Maria",
      "reveal": {
        "chapter": 20
      },
      "role": "supporting"
    },
    {
      "aliases": [
        "Carmen"
      ],
      "description": "The title used for Carmen by Valhal fighters when reinforcements arrive to support her group. She is already established as a powerful close-range combatant and Sylphie's current hunting partner, and the arriving party clearly recognizes her standing.",
      "id": "rune-maiden",
      "name": "Rune Maiden",
      "reveal": {
        "chapter": 22
      },
      "role": "supporting"
    },
    {
      "description": "A leader of the Valhal party arriving to support Carmen, Miranda, and Sylphie. He addresses Carmen as the Rune Maiden when the reinforcements join her group.",
      "id": "sven",
      "name": "Sven",
      "reveal": {
        "chapter": 22
      },
      "role": "supporting"
    },
    {
      "description": "Sultan's contracted pathfinder. Her ability to mark targets and perceive through them helps him locate a defended vault in the expanded Treasure Hunt territory, supplying the guidance needed for his armed ship to approach its objective.",
      "id": "summer",
      "name": "Summer",
      "reveal": {
        "chapter": 33
      },
      "role": "minor"
    },
    {
      "description": "An elemental mage trapped with Jake and several others by a vast cube puzzle. He specializes in construction, reinforcement, material alteration, and elemental magic circles, making him one of the group's principal solvers.",
      "id": "elemental-mage",
      "name": "Elemental Mage",
      "reveal": {
        "chapter": 34
      },
      "role": "supporting"
    },
    {
      "description": "An assassin from the Court of Shadows trapped with Jake's group by the cube puzzle. Knowledge of gunsmithing, enchantment, and runes makes this fighter one of the principal contributors to solving it.",
      "id": "court-of-shadows-assassin",
      "name": "Court of Shadows Assassin",
      "reveal": {
        "chapter": 34
      },
      "role": "supporting"
    },
    {
      "description": "A swordsmith and close-range fighter trapped with Jake's group by the cube puzzle. She provides limited help with the puzzle while the group works to escape the hidden space.",
      "id": "swordsmith-rogue",
      "name": "Swordsmith Rogue",
      "reveal": {
        "chapter": 34
      },
      "role": "supporting"
    },
    {
      "description": "An earth mage trapped with Jake's group by the cube puzzle. He takes part in the group's effort to complete the puzzle and leave the hidden space.",
      "id": "earth-mage",
      "name": "Earth Mage",
      "reveal": {
        "chapter": 34
      },
      "role": "supporting"
    },
    {
      "description": "A level-130 healer and pioneering city lord who commands the independent force surrounding Jake's cube-vault group. He leads the organized effort to drive Jake out of the Treasure Hunt.",
      "id": "independent-city-lord",
      "name": "Independent City Lord",
      "reveal": {